{
  "schema_version": "treatcode.platform.fixture.v1",
  "fixture_id": "tc:fixture:p01-valid-platform",
  "description": "A synthetic but repository-backed TreatCode graph covering Trit, a cross-layer capability, lifecycle decisions, benchmark evidence, and a scoped agent task.",
  "entities": [
    {
      "schema_version": "treatcode.platform.entity.v1",
      "id": "tc:project:trit",
      "entity_type": "project",
      "name": "Trit",
      "description": "The Trit ternary ISA, compiler, runtime, kernel, and operating-system project.",
      "repository": "https://github.com/JonasComlita/dualrail",
      "default_branch": "codex/v2-clean-cutover",
      "statuses": {"decision": "accepted", "maturity": "implemented", "evidence": "verified", "compatibility": "compatible"},
      "status_history": [{"at": "2026-07-30T00:00:00Z", "commit": "d168bc845babad7d6031bed98a16e3a471d200c5", "statuses": {"decision": "accepted", "maturity": "implemented", "evidence": "verified", "compatibility": "compatible"}, "actor": "platform-architecture"}],
      "relations": [
        {"type": "depends_on", "target_id": "tc:layer:compiler"},
        {"type": "depends_on", "target_id": "tc:layer:runtime"},
        {"type": "affects", "target_id": "tc:task:p01-domain-contracts"}
      ],
      "source_refs": [{"repository": "https://github.com/JonasComlita/dualrail", "commit": "d168bc845babad7d6031bed98a16e3a471d200c5", "path": "README.md"}],
      "evidence_refs": [{"repository": "https://github.com/JonasComlita/dualrail", "commit": "d168bc845babad7d6031bed98a16e3a471d200c5", "path": "TEST_MANIFEST.json", "description": "Authoritative repository test manifest", "kind": "test"}]
    },
    {
      "schema_version": "treatcode.platform.entity.v1",
      "id": "tc:layer:compiler",
      "entity_type": "layer",
      "name": "Compiler",
      "description": "Lexing, parsing, IR, code generation, and assembly for Trit programs.",
      "ordinal": 2,
      "layer_kind": "software",
      "owner": "compiler-team",
      "statuses": {"decision": "accepted", "maturity": "implemented", "evidence": "verified", "compatibility": "compatible"},
      "status_history": [{"at": "2026-07-30T00:01:00Z", "commit": "d168bc845babad7d6031bed98a16e3a471d200c5", "statuses": {"decision": "accepted", "maturity": "implemented", "evidence": "verified", "compatibility": "compatible"}}],
      "relations": [
        {"type": "depends_on", "target_id": "tc:layer:runtime"},
        {"type": "compatible_with", "target_id": "tc:contract:syscall-abi-v1"}
      ],
      "source_refs": [{"repository": "https://github.com/JonasComlita/dualrail", "commit": "d168bc845babad7d6031bed98a16e3a471d200c5", "path": "ternary_compiler.h"}],
      "evidence_refs": [{"repository": "https://github.com/JonasComlita/dualrail", "commit": "d168bc845babad7d6031bed98a16e3a471d200c5", "path": "TEST_MANIFEST.json", "description": "Compiler regression suite inventory", "kind": "test"}]
    },
    {
      "schema_version": "treatcode.platform.entity.v1",
      "id": "tc:layer:runtime",
      "entity_type": "layer",
      "name": "Host and OS Runtime",
      "description": "The host runtime, kernel-facing ABI, image runtime, and operating-system execution layer.",
      "ordinal": 4,
      "layer_kind": "software",
      "owner": "runtime-team",
      "statuses": {"decision": "accepted", "maturity": "implemented", "evidence": "verified", "compatibility": "compatible"},
      "status_history": [{"at": "2026-07-30T00:02:00Z", "commit": "d168bc845babad7d6031bed98a16e3a471d200c5", "statuses": {"decision": "accepted", "maturity": "implemented", "evidence": "verified", "compatibility": "compatible"}}],
      "relations": [
        {"type": "implements", "target_id": "tc:contract:syscall-abi-v1"},
        {"type": "depends_on", "target_id": "tc:component:host-runtime"}
      ],
      "source_refs": [{"repository": "https://github.com/JonasComlita/dualrail", "commit": "d168bc845babad7d6031bed98a16e3a471d200c5", "path": "ternary_host_runtime.h"}],
      "evidence_refs": [{"repository": "https://github.com/JonasComlita/dualrail", "commit": "d168bc845babad7d6031bed98a16e3a471d200c5", "path": "TEST_MANIFEST.json", "description": "Runtime and OS production test suites", "kind": "test"}]
    },
    {
      "schema_version": "treatcode.platform.entity.v1",
      "id": "tc:component:host-runtime",
      "entity_type": "component",
      "name": "Ternary Host Runtime",
      "description": "The native host-side runtime used to execute and inspect Trit OS images.",
      "layer_id": "tc:layer:runtime",
      "component_kind": "runtime",
      "maintainers": ["runtime-team"],
      "statuses": {"decision": "accepted", "maturity": "implemented", "evidence": "verified", "compatibility": "compatible"},
      "status_history": [{"at": "2026-07-30T00:03:00Z", "commit": "d168bc845babad7d6031bed98a16e3a471d200c5", "statuses": {"decision": "accepted", "maturity": "implemented", "evidence": "verified", "compatibility": "compatible"}}],
      "relations": [
        {"type": "implements", "target_id": "tc:contract:syscall-abi-v1"},
        {"type": "produces", "target_id": "tc:artifact:p01-schema-evidence"}
      ],
      "source_refs": [{"repository": "https://github.com/JonasComlita/dualrail", "commit": "d168bc845babad7d6031bed98a16e3a471d200c5", "path": "ternary_host_runtime.h"}],
      "evidence_refs": [{"repository": "https://github.com/JonasComlita/dualrail", "commit": "d168bc845babad7d6031bed98a16e3a471d200c5", "path": "tests/test_agent_tooling.py", "description": "Host-runtime tooling regression coverage", "kind": "test"}]
    },
    {
      "schema_version": "treatcode.platform.entity.v1",
      "id": "tc:capability:cross-layer-syscall-abi",
      "entity_type": "capability",
      "name": "Cross-layer syscall ABI",
      "description": "A capability spanning compiler wrappers, runtime IDs, kernel dispatch, and app SDK calls.",
      "layer_ids": ["tc:layer:compiler", "tc:layer:runtime"],
      "capability_kind": "cross-layer",
      "acceptance": ["Compiler and SDK wrappers name the same syscall IDs", "Kernel dispatch and runtime tests agree on the ABI"],
      "statuses": {"decision": "accepted", "maturity": "integrated", "evidence": "verified", "compatibility": "compatible"},
      "status_history": [{"at": "2026-07-30T00:04:00Z", "commit": "d168bc845babad7d6031bed98a16e3a471d200c5", "statuses": {"decision": "accepted", "maturity": "integrated", "evidence": "verified", "compatibility": "compatible"}}],
      "relations": [
        {"type": "implements", "target_id": "tc:contract:syscall-abi-v1"},
        {"type": "verified_by", "target_id": "tc:test:syscall-abi"},
        {"type": "benchmarked_by", "target_id": "tc:benchmark:os-platform"},
        {"type": "compatible_with", "target_id": "tc:implementation:runtime-syscalls"}
      ],
      "source_refs": [{"repository": "https://github.com/JonasComlita/dualrail", "commit": "d168bc845babad7d6031bed98a16e3a471d200c5", "path": "SYSCALL_MANIFEST.json"}],
      "evidence_refs": [{"repository": "https://github.com/JonasComlita/dualrail", "commit": "d168bc845babad7d6031bed98a16e3a471d200c5", "path": "TEST_MANIFEST.json", "description": "OS platform suite covers syscall ABI integration", "kind": "test"}]
    },
    {
      "schema_version": "treatcode.platform.entity.v1",
      "id": "tc:contract:syscall-abi-v1",
      "entity_type": "contract",
      "name": "Trit syscall ABI",
      "description": "The versioned mapping between compiler wrappers, runtime syscall IDs, and kernel dispatch.",
      "contract_kind": "abi",
      "contract_version": "v1",
      "surface": ["SYSCALL_MANIFEST.json", "ternary_compiler_ir.h", "kernel.trit", "apps/os_sdk.trit"],
      "statuses": {"decision": "accepted", "maturity": "specified", "evidence": "verified", "compatibility": "compatible"},
      "status_history": [{"at": "2026-07-30T00:05:00Z", "commit": "d168bc845babad7d6031bed98a16e3a471d200c5", "statuses": {"decision": "accepted", "maturity": "specified", "evidence": "verified", "compatibility": "compatible"}}],
      "relations": [
        {"type": "depends_on", "target_id": "tc:layer:compiler"},
        {"type": "compatible_with", "target_id": "tc:implementation:runtime-syscalls"}
      ],
      "source_refs": [{"repository": "https://github.com/JonasComlita/dualrail", "commit": "d168bc845babad7d6031bed98a16e3a471d200c5", "path": "SYSCALL_MANIFEST.json"}],
      "evidence_refs": [{"repository": "https://github.com/JonasComlita/dualrail", "commit": "d168bc845babad7d6031bed98a16e3a471d200c5", "path": "SYSCALL_MANIFEST.json", "description": "Authoritative syscall ABI manifest", "kind": "build"}]
    },
    {
      "schema_version": "treatcode.platform.entity.v1",
      "id": "tc:implementation:runtime-syscalls",
      "entity_type": "implementation",
      "name": "Runtime syscall implementation",
      "description": "The compiler/runtime/kernel implementation of the v1 syscall ABI.",
      "component_id": "tc:component:host-runtime",
      "implementation_kind": "host-and-guest-runtime",
      "language": "C++ and Trit",
      "statuses": {"decision": "accepted", "maturity": "integrated", "evidence": "verified", "compatibility": "compatible"},
      "status_history": [{"at": "2026-07-30T00:06:00Z", "commit": "d168bc845babad7d6031bed98a16e3a471d200c5", "statuses": {"decision": "accepted", "maturity": "integrated", "evidence": "verified", "compatibility": "compatible"}}],
      "relations": [
        {"type": "implements", "target_id": "tc:contract:syscall-abi-v1"},
        {"type": "produces", "target_id": "tc:artifact:p01-schema-evidence"},
        {"type": "included_in_release", "target_id": "tc:release:platform-contracts-v1"}
      ],
      "source_refs": [{"repository": "https://github.com/JonasComlita/dualrail", "commit": "d168bc845babad7d6031bed98a16e3a471d200c5", "path": "kernel.trit"}],